{
  "version": 1,
  "node": "RELEASE-VERIFY",
  "digest": "d5b0fbcb43a19802c4f28610f73e50f9e49404348399474bdc5ddf6f2c38e069",
  "result": "passed",
  "recordedAt": "2026-08-31T22:49:07.581603Z",
  "evidence": {
    "path": ".groundspec/evidence/groundspec-release-matrix.json",
    "digest": "2d2e15485f8887a1dbbcb07ae9ab475f37f9b8ad2b7792b5834221e155817f55"
  }
}
