{
  "version": 1,
  "node": "JS-VERIFY",
  "digest": "7d606491e51b76a77823969595393b07552fa21dcdce91777c02bbcf62de3237",
  "result": "passed",
  "recordedAt": "2026-08-31T22:20:26.978272Z",
  "evidence": {
    "path": ".groundspec/evidence/js-tests.tap",
    "digest": "dd164b820a4a2b7978fa0627540c17774ae1ff5efd90a6cf1915e8d38fcb2448"
  }
}
