{
  "version": 1,
  "node": "LIFECYCLE-VERIFY",
  "digest": "a2442dd2bf428edb4a037d0aaca9e84f3af642ed4c552a0f7db61701cd32097d",
  "result": "passed",
  "recordedAt": "2026-08-31T21:08:06.201305Z",
  "evidence": {
    "path": ".groundspec/verification.json",
    "digest": "dab577a660f3483a9dc1eaa9cce89ffd2c68ae8ff1695ec817a90832e70d39c9"
  },
  "note": "Reviewed implementation and all eight required commands passed"
}
